Sr.No.,Category,Title,Author,Abstract,Conclusion ,Discussion
27,AMR RESISTANCE,One health and AMR - US Perpesctive ,Ponte et.al,"Antimicrobial medications are a valuable resource that have saved millions of lives since their discovery. Unfortunately, due to the development and spread of antimicrobial resistance (AMR), a multifaceted and complicated problem affecting humans, animals, plants, and the environment, several antimicrobials are rapidly losing their effectiveness. While AMR is a global issue, the authors of this paper briefly outline some ongoing efforts in the United States of America to integrate a One Health approach into policies and programmes to address this significant health hazard. ","The One Health approach recognises that the health of people, animals, plants, and the environment are all interconnected. To achieve optimal health for each, existing collaboration initiatives across disciplines and sectors must be expanded. Antimicrobial resistance is a multifaceted issue that impacts humans, animals, plants, and the environment, necessitating a One Health approach to detection and mitigation. Multiple collaborative activities are underway in the United States to conduct AMU and AMR surveillance and to improve AMU across all sectors, with the overarching goals of increasing our understanding of this complex issue, slowing the development of AMR, and preserving antimicrobial effectiveness.",
28,AMR RESISTANCE,Antimicrobial resistance and One Health,Serna et. Al,"Antimicrobial resistance is one of the most serious public health issues of the twenty-first century. We can no longer understand global health without considering the interconnection of the human, animal, and environmental elements. To address this issue, it is therefore logical to take a ""One Health"" strategy. This review explains why collaboration across all sectors and professions is required to attain optimal health for people, animals, plants, and the environment.","AMR is becoming a more concerning occurrence. We have showed in this brief review how this dilemma involves multiple actors. AMR jeopardises the use of so-called last-resort antibiotics (such as colistin and carbapenems) in humans. In recent years, action plans including and coordinating both sectors have been implemented. We cannot properly comprehend the issue unless we examine the environment, which serves as a shared link to global health. As a result, effective collaboration among all actors (people, animals, and the environment) is critical to combating this uncontrolled pandemic.",
29,AMR RESISTANCE,"Assessing Environmental Factors within the One
Health Approach",Dachroeden and Mantovani,"One Health is a multifaceted approach to assessing and investigating the health of animals, humans, and the environment. However, as the One Health idea gains traction, its practical implementation encounters roadblocks. This study investigates the environmental pillar of the One Health approach, highlighting the integration of environmental factors through two case studies. The first case study is on DANMAP, Denmark's antimicrobial resistance monitoring and surveillance programme. The second case shows the presence of aflatoxin M1 (AFM1) in milk from dairy-producing ruminants in several Italian locations.","One Health is a growing, multidimensional web of feedbacks and interactions amongst its components. The idea is to handle complexity rather than drown in it. More research is required to better characterise the functions of the environment in One Health scenarios. Characterization of environmental elements is critical for modelling the dangers to animal and human health. One Health should be used as an institutional tool in public health, particularly for evidence-based priority setting and decision-making assistance.
More case studies are required to emphasise the significance of the environment and the benefits of environmental expertise in relation to human and animal health.","The two case studies illustrate how the environment interacts with the health of
humans and animals, making up an essential pillar of One Health. Indeed, environment related factors can play multiple roles that need proper characterisation to manage the
complexity inherent to One Health issues.  1. Climate Change Modulating Risk Factors for Health 2.The Anthropogenic Environment as a Source of One Health Risk Factors 3.Way Forward for the Environment and One Health 3. Way Forward for the Environment and One Health

"
30,AMR RESISTANCE,"Antibiotic resistome from the One-Health
perspective: understanding and controlling
antimicrobial resistance transmission",Kim and Cha,"The notion of the antibiotic resistome was presented just over a decade ago, and active resistome investigations have been carried out since then. In this paper, we describe the previously established concept of the resistome, which includes all types of antibiotic resistance genes (ARGs), as well as key findings from each One-Health sector that take this concept into account, emphasising the importance of the One-Health approach in understanding ARG transmission. Cutting-edge research approaches are required to unravel the complex resistome structure in human, animal, and environmental microbiomes. Future directions for resistome research have been recommended to better the understanding and control of ARG transmission based on previous achievements of resistome studies in several One-Health sectors: a ranking of the most important ARGs and their hosts. ","  Understanding and mitigating ARG transmission between the One-Health sectors requires an understanding of the antibiotic resistome and a OneHealth methodology. Although significant AMR results in these areas have recently been revealed, different elements must be investigated to understand the formation, development, dissemination, and evolution of ARGs. Several research subjects identified in this study should be pursued further in the near future based on cutting-edge technologies. Such efforts will help us overcome the arms race between antibiotics and AMR.","Over the last decade, the paradigm of AMR research has
changed, as the origin, transmission, and evolution of
AMR have been discovered; however, as ARG transmis sion to humans from other One-Health sectors is only partially understood, it is expected that in the future, the
following research approaches will be conducted based on
the foundation of scientific achievements over the last
decade. These attempts will improve our understanding of
ARG transmission and guide strategies to mitigate AMR
dissemination"
31,AMR RESISTANCE,"Antimicrobial resistance from a One Health 
perspective in Zambia: a systematic review",Nowbuth et.al,"Antimicrobial resistance (AMR) is well recognised as a global health issue, but its scope is unknown, particularly in low- and middle-income nations. It is difficult to advocate policies without focusing on local healthcare systems; consequently, a baseline assessment of AMR prevalence is a necessity. This study sought to examine published articles pertaining to the availability of AMR data in Zambia in order to establish an overview of the situation and help inform future decisions.
","This review focuses on three key findings. To begin with, AMR is understudied in Zambia. Second, resistance to routinely given antibiotics is widespread in the human, animal, and environmental sectors. Third, our analysis proposes that enhanced standardisation of antimicrobial susceptibility testing in Zambia may aid in better delineating AMR trends, allowing comparisons across different sites, and tracking AMR evolution over time.",
32,AMR RESISTANCE,One Health and antimicrobial stewardship: Where to go from here?,McCubbin et.al,"Antimicrobial resistance (AMR) is a slow-moving epidemic that threatens our socioeconomic prosperity as well as our ability to treat illnesses in humans and animals. Given the interconnection of humans, animals, and their ecosystems, it is becoming increasingly important that AMR solutions employ a One Health approach to address this complicated challenge.","One of the most significant integrations across the One Health spectrum to discuss AMS in Canada was the 2021 One Health Antimicrobial Stewardship Conference. Previous AMS efforts produced meaningful integration and cross-learning across the human and animal health and agriculture sectors, but environmental sector engagement remained elusive. This meeting's knowledge and contacts with environmental AMR experts were quite encouraging. Future work must establish and grow these links by involving suitable members of the federal, provincial, and territorial governments' environmental sectors.",
33,GLOBAL HEALTH SECURITY,"Advancing One human–animal–environment Health for 
global health security: what does the evidence say?",Zinsstag et.al ,"We discuss the contributions of One Health approaches (i.e., at the human-animal-environment interface) to improving global health security across a variety of health threats, and we highlight recent evidence of incremental benefits of a One Health approach. The significant expansion of domestic animal populations (e.g., cattle, pigs, poultry, sheep, and goats), as well as changed landscapes intended for human populations, are having dramatic consequences on the evolution and epidemiology of infectious and noncommunicable diseases in all species. Although technological advances are improving public health services' ability to detect, prevent, and control new infectious diseases and other health hazards, significant gaps remain in the translation of these advances into effective actions and policies at the animal-human-environment interface.","One Health approaches demonstrate quantitative incremental benefits for health services and infrastructure, surveillance-response systems, antimicrobial resistance, food safety, nutrition security, environmental sanitation, and zoonoses control for global health security; however, gaps in One Health implementation remain to cover all species of interest. The evidence basis for One Health programmes focused on prevention and preparedness across the spectrum of threats to global health security is generally stronger. To optimise and extend such benefits for global health security, a broader, worldwide implementation of One Health is required, which should be planned in multiannual national plans and involve enhanced allocations of resources for preventive and preparedness in addition to reaction. ",
34,GLOBAL HEALTH SECURITY," After 2 years of the COVID-19 pandemic, translating 
One Health into action is urgent",Lefrançois et.al,"Emerging diseases produced by new pathogens or re-emerging infectious diseases occur on a regular basis and are becoming more common. Several studies have found that the cost of preventing an infectious disease is substantially lower than the cost of controlling one, particularly on a worldwide scale. To better pandemic prevention, a shift in the health-care structure is required, as well as a global understanding of disease onset and an integrated One Health approach. COVID-19 has highlighted the gap between government promotion of the One Health approach in international arenas (e.g., political conferences) and reality outside of government spaces—namely, the lack of an efficient, comprehensive One Health surveillance system that could have been in place from the start of the pandemic.","The One Health idea extends beyond the prevention of health crises to include a holistic view of health and the connections between health, environmental quality, climate, food and agriculture, and biodiversity. investigations in 2022, as well as previous but still significant investigations, have demonstrated and confirmed the link between climate change, biodiversity issues, and new zoonotic illnesses. One Health encompasses the difficulties recognised by all and shared by all social goals. To achieve the Sustainable Development Goals, the One Health objectives, as well as global empowerment, must be addressed at the global level.",
35,GLOBAL HEALTH SECURITY,One Health action for health security and equity,Markotter et.al,"The Lancet series on One Health underlines the need of integrated One Health methods in reducing the risk and impact of developing infectious disease outbreaks. However, implementing One Health necessitates multidisciplinary approaches with a systemic focus on the health of animals, humans, and ecosystems around the world, as well as viable solutions that are egalitarian, inclusive, and long-term.","The number of health security projects now receiving short-term project funding undermines the utility and sustainability of collaborations.
Everyone's interest is in global health security, which is now at a crossroads. Continue on a road marred by short-termism, siloed labour, vast power disparities, and institutional rivalries.",
36,OH CONSORTIUM,"Promoting the One Health concept:
Thai Coordinating Unit for One Health",Tangwangvivat et. Al,"Within Thailand, One Health has gained traction in government agencies, academic institutions, intergovernmental groups, and civil society organisations over the previous decade. One Health is a multisectoral and multidisciplinary strategy to improving the health of everyone that connects the human, animal, and environmental health sectors. 
The Coordinating Unit for One Health (CUOH), situated inside the Thai Ministry of Public Health, was officially established in 2014 to act as a focal point within Thailand for local and worldwide One Health collaboration. The major tasks of the unit are to share data, information, and resources, as well as to promote One Health operations throughout the country. The CUOH Steering Committee meets on a regular basis to provide technical and administrative guidance on the CUOH's functions and directions. ","One Health can also be used for more complex situations. EIDs do not solve all difficulties. The country's systems should be able to deal with a variety of situations, including political ones. Instability and staff changes in decision-making coordination positions. One approach to accomplish this is to secure 
Political backing for the establishment of One Health capability. International Health Organisation integration and alignment World Health Organisation (WHO) International Health Regulations (IHR) and the Pathway for Veterinary Performance (PVS) .The World Organisation for Animal Health's (OIE) assist national policymakers in comprehending and appreciating the significance of investing in One Health capabilities development, and that it necessitates ongoing commitment. This will become increasingly important as the The agricultural sector is coping with increased demand and with the anticipated changes to the environment and ecology systems.",
37,OH CONSORTIUM,"From the Approach to the Concept:
One Health in Latin
America-Experiences and
Perspectives in Brazil, Chile, and
Colombia","Brewer et,al","The concept of One Health is not a new one. Although there have been moments when medical practitioners and veterinarians have collaborated in the past, it may be too broad to assume that such collaboration was typical. Indeed, one of the reasons Rudolf Virchow strove for ""one medicine"" (later described as One Health) in the nineteenth century was a lack of collaboration between doctors and veterinarians. The twentieth century, however, brought more isolation and separation between these two domains of research. Given the current accelerated global development, collaborative efforts and durable partnerships in a specific area should contribute to consistent strengths in order to provide meaningful findings, with direct applications in the areas studied and into the communities.
","While the One Health approach is widely regarded as critical for addressing complex governance challenges and is widely supported in theory, its implementation in practise remains limited, owing to a lack of financial support and a secular anthropogenic and self-centered mentality.
Overall, the world must continue to work to establish a uniform system of equal health assessment, as well as to build long-term procedures for collaboration and communication among relevant organisations and ministries for human, plant, and animal health. In addition, link national, regional, and international strategies with collaboration, cooperation, and intersectoral partnership in order to put the concept of environmental conservation into practise on a daily basis.
","To further develop the One Health concept, we must consider
taking into account the accelerated advances in science and
the globalization of our economies. This has been important
because about 75% of emerging infectious diseases have been
shared between humans and domestic and/or wild animals.
Emerging zoonotic diseases that affect Latin American countries
today result from interactions between natural and human animal-plant systems. Infectious agents, such as Salmonella spp.,
Escherichia coli, tuberculosis, malaria, yellow fever, influenza
A(H1N1), West Nile Virus, Zika, Dengue, Chikungunya, and
SARS-CoV-2, have been examples in which animals, humans,
and the environment have been intrinsically related. In these
cases, animals were also victims of the emerging infectious
diseases transmitted by vectors being sentinels for human health
and a sign of an imbalance in the environment, especially
by habitat destruction due to deforestation or pollution. In
addition, emerging or neglected zoonotic diseases, such as
hantavirus pulmonary syndrome, leptospirosis, trypanosomiasis
(Chagas disease caused by Trypanosoma cruzi and other species),
brucellosis, hanseniasis, treponemas, and leishmaniasis arose
when human beings have invaded forest region, increasing the
contact between people wild animals who might act as pathogen
reservoirs."
38,OH CONSORTIUM,"One Health as a catalyst for sustainable 
development",,"The COVID-19 pandemic has emphasised the potential of One Health initiatives to expedite progress towards the SDGs, which have a deadline of 2030. Recognising that ""the health of humans, domestic and wild animals, plants, and ecosystems are inextricably linked and interdependent,"" One Health initiatives aim to enhance disease management by bringing together medical, veterinary, and environmental professionals, as well as policy experts.
","The COVID-19 pandemic has emphasised the potential of One Health initiatives to expedite progress towards the SDGs, which have a deadline of 2030. Recognising that ""the health of humans, domestic and wild animals, plants, and ecosystems are inextricably linked and interdependent,"" One Health initiatives aim to enhance disease management by bringing together medical, veterinary, and environmental professionals, as well as policy experts.",
39,OH CONSORTIUM,International Conventions & One Health,Atanu Basu  &  Harpreet Sandhu,"Environmental changes and biosphere erosion caused by unregulated human habitat development pose a cumulative risk to both human and animal health. The introduction of new illnesses into humans from previously undiscovered animal reservoirs, followed by deadly outbreaks and pandemics, has altered the path of human history and civilization's footprints. Human health is inextricably linked to animal health, and vice versa. The activity of the Ebola virus in Africa, avian influenza in various parts of the world, the Nipah virus in South Asia, and the ongoing COVID-19 pandemic caused by a novel coronavirus SARS-CoV-2 have served as a wake-up call for governments and international organisations responsible for combating infectious diseases. As a result, a collaborative, well-coordinated, interdisciplinary strategy that pools varied resources and multiple perspectives is required.","The significance of basics in One Health has been emphasised even more by the current epidemic of COVID-19. It has identified gaps in the present framework and shortcomings in synchronised response-mitigation deployment systems for dealing with public health emergencies. It is past time to comprehend, broaden the scope of animal-human-environment interaction on health, One Health, implement appropriate actions, introduce new legislations, frame international laws, adapt and renovate relevant existing conventions, strengthen agreements, and deploy at all levels (local, national, and global) to combat the threat of emerging future pandemics.

",
40,OH CONSORTIUM,"One Health/EcoHealth capacity building
programs in South and South East Asia: a
mixed method rapid systematic review","Chatterjee et al.
","Although One Health (OH) and EcoHealth (EH) have been recognised for providing complete and holistic approaches to studying complex problems such as zoonoses and emerging infectious diseases, integrating them in a problem-solving paradigm remains a difficulty. One of the most significant hurdles, particularly in low- and middle-income nations, is a lack of ability to conduct OH/EH investigations. To help map the present efforts in this area, a fast evaluation was conducted to conduct a scenario analysis of the existing OH/EH capacity building programmes, with a focus on those programmes with considerable OH engagement.","In both SA and SEA, investment in research capacity building is low. The situation appears to be more dire in SA, whereas SEA has been able to define the OH/EH agenda and strategize capacity building in core competences through regular investment and support. To effectively address disease emerging hotspots in these places, targeted funding decisions targeting capacity building in fundamental OH/EH competences, including transdisciplinarity, systems thinking, and adaptive management, are required.
","The paucity of peer-reviewed literature documenting
OHEHCB efforts in the two regions was an early indica tor that there has not been an adequate focus on it.
OHEHCB initiatives in both the regions are a recent
phenomenon and could reflect the consequence of re peated EID events that have incited the interest of do nors and the international community at large. Except
for some country-to-country variations, the agenda have
essentially been moved by international donor agencies,
with ownership by national governments still emerging.
OHEHCB programs across the regions have been char acterized by universities as an entry point for initiating
the movement. This is similar to the North American
experience where the OHCB movement has traditionally
been led by schools of veterinary medicine and public
health in different universities. Common focus on both
regions on field epidemiology as an essential component
of OHEHCB is an indication of the ever burgeoning
need to strengthen the frontline capacity of health sys tems. Additionally, in both the regions, capacity building
in wildlife-related issues was limited. Considering the
fact that almost three fourths of emerging zoonoses ori ginate from wildlife sources [23], this is a major area of
concern that needs to be addressed in future OHEHCB
efforts"
41,STAKEHOLDER,Stakeholders in One Health,Mazet et.al,"The ultimate beneficiaries (animals, people, and the environment) and the entities that work to safeguard them (research institutes, government departments, international organisations, and professional bodies) are all stakeholders in One Health. Identifying these stakeholders who will contribute to One Health initiatives and produce answers to complicated health problems, however, can be difficult because these problems frequently affect all sectors of society. Furthermore, shifting notions about health and its reliance on environmental resilience need the participation of ministries, organisations, and disciplines that were not previously seen to be relevant to health. The multilateral agencies with the most responsibilities in the global health arena have understood that collaboration is the best strategy to protect health security and improve overall global well-being. Finally, communities, including rural and indigenous peoples, are crucial to the One Health idea, particularly those located near natural resources.","Communities, including rural and indigenous peoples, are at the centre of the One Health idea, particularly those located near natural resources. Communities are immediately affected by imbalances caused by poor health and sickness because they are both users and important components of the complex matrix of interactions that maintain the functionality of the natural world.  In any case, the inclusion of stakeholders at all levels, from multilateral global organisations to relevant governmental departments and grass-roots communities, is critical to the implementation of the One Health approach and the eventual development of solutions to health problems affecting all sectors of society.
",
