Sr.No.,Category,Title,Author,Abstract,Conclusion ,Discussion
53,ETHICS,Biothreat & One Health: Current scenario & way forward,Kotwal and Yadav,"Humans, animals, and the environment are becoming more interconnected, and the current epidemic has demonstrated the interdependence of human, animal, and environmental health. This interconnectedness, as well as variables such as population growth, migration, urbanisation, and climate change, all contribute considerably to the increased likelihood of previously undiscovered wildlife source diseases emerging at any time, at any place, and without notice. The vast potential for the deliberate deployment of biological agents as weapons by State or non-State groups looms in the background. Biological weapons have been employed in warfare since antiquity; however, current research and tactics have made these actual threats with a wide range of potential harm to humans, animals, and crops. It has grown increasingly difficult to distinguish between planned and natural biothreat situations over time. The approach to both sorts is the same: save lives, cattle, crops, and the environment while minimising the socioeconomic consequences. Biothreats can be directed towards humans, animals, or crops, or all three at the same time. Every country, including India, is vulnerable to biothreats. As a result, the concept of one health is critical for reacting to emerging infectious diseases or biothreats. Comprehensive surveillance for early identification, reporting, and coordinated action are required for the prevention and mitigation of biothreats, which necessitate strong cooperation and collaboration among numerous stakeholders both within and outside of each country. ","The probability of biothreat, whether natural or intentional, exists. Newer molecular techniques and technological advancements might serve as both possibilities and barriers. The One Health concept, which recognises the relationship between human, animal, and plant health and the effect of disease on food sources and the economy, would improve early identification, mitigation, and response. A One Health approach with improved coordination, trans-disciplinary and multisectoral actions for designing and implementing policies, programmes, and legislation based on basic and applied research, coupled with effective surveillance systems, early detection, and actions to contain outbreaks of local / national / international concern, as well as rapid and transparent information sharing with increased global cooperation and participation, would have a positive impact.
",
54,ETHICS,One Health: a call for ecological equity,,"The idea that an individual's well-being is inextricably linked to the well-being of the land has a long history in Indigenous civilizations. Nowadays, the notion of One Health is widely used in global health. 
One Health is defined by the One Health High-Level Expert panel as ""an integrated, unifying approach that aims to sustainably balance and optimise the health of people, animals, and ecosystems."" It acknowledges that the health of humans, domestic and wild animals, plants, and the larger environment (including ecosystems) are inextricably interrelated and interdependent."" We launched a new four-part Series on One Health and global health security online on January 19, which evaluates existing understanding of potential public health emergencies and investigates how effective implementation of One Health could benefit global health.","In actuality, One Health will be given in countries, rather than multilateral treaties organisations, but by adopting a radically different orientation to the natural world, one in which we are as individuals worried about non-human animal welfare and We are as concerned about the environment as we are about humans. In its purest form In this way, One Health is a demand for ecological, not only social, change Health and equity.
",
55,ETHICS,"One Health Animal Disaster Management: An
Ethics of Care Approach",Anthony et.al,"Using the One Health framework for providing direction for animal disaster management using an ethics of care approach. While One Health was developed at the start of the twenty-first century in response to the persistence of emerging infectious diseases and the belief that the health of humans and other animals is contiguous, it can be a useful tool for promoting animal welfare and taking into account animals' experiences during a disaster. However, incorporating One Health principles into animal disaster management is not without obstacles, because all decisions and recommendations made regarding how to conceptualise a ""disaster"" and its impact on animals and their welfare include ethical judgements.","An EC approach broadens OHADM's ethical and scientific perspectives by framing and addressing health and welfare issues holistically, incorporating multiple grounds for resource distribution and embodying distinct policies, practises, and actions for animal others. 
However, incorporating OH methods into ADM is not without obstacles, because all decisions and recommendations about how to conceptualise a disaster's impact on animals and their welfare include ethical judgements. According to UNESCO, relational solidarity emphasises the interdependence of human, animal, and environmental health.",
56,PERSPECTIVES,"One Health for a changing world:
new perspectives from Africa","Cunningham AA, Scoones I,
Wood JLN. ","This study examines the complex interactions between ecosystems, diseases, and poverty patterns, as well as the underlying social and political factors, the possibilities for integrative modelling, and the policy and practise reforms required to implement a One Health strategy.
","The significance of governmental interventions aimed at restricting the wildlife trade, as well as the need to conduct environmental and disease impact assessments on investments and development projects. Furthermore, they recommend long-term, strategic monitoring to get insights into important driving change trajectories. When evaluating policy responses, make the politics of One Health clear, and emphasise the underlying structural vulnerabilities that produce disease loads and consequences in the first place.",
57,PERSPECTIVES,"One Health Perspectives on Emerging Public Health 
Threats",Ryu et.al ,"Following indigenous research methodology principles, indigenous peoples' involvement in the research, including indigenous writers, should be sought and fully described in order to prioritise indigenous voices. In recent years, antimicrobial resistance and new infectious diseases such as avian influenza, Ebola virus disease, and Zika virus disease have had a profound impact on humanity. There was no separation between animal and human medicine in the premodern times. However, as medical research advanced, the divide between human and animal science widened. Cooperation between human, animal, and environmental scientists to tackle rising public health hazards has emerged as a key problem under the One Health Initiative. In this paper, we discussed the history of One Health, contemporary public health risks, and prospects for the field of public health through a greater knowledge of the One Health paradigm.

","Following indigenous research methodology principles, indigenous peoples' involvement in the research, including indigenous writers, should be sought and fully described in order to prioritise indigenous voices.
The concept of One Health is broadly acknowledged in general. However, due to the substantial distance between animal and human health, multi-sectoral cooperation in the surveillance and control of new infectious diseases is difficult to achieve. To close this gap, the European Union and the United States have contributed money to encourage interdisciplinary research under the One Health paradigm, such as research on therapies for new zoonotic diseases and early warning systems of animal risks to humans. Given its significance in mitigating the public health danger posed by new infectious diseases and current international trends, the implementation of the One Health approach through multi-sectoral collaborative initiatives should be discussed on a regular basis.

",
58,PERSPECTIVES,One World One Health: Widening horizons,Panda et.al,"Antimicrobial resistance, which was spreading like wildfire over the world, began to make its presence known as well. Then there was 'Bird Flu,' 'Ebola,' and 'Severe Acute Respiratory Syndrome (SARS),' while the old opponents continued to show their power. As a result, the World Health Organisation (WHO) had to amend the International Health Regulations (IHR) 1969 in 2005 to include any public health emergency of international concern (PHEIC) as notifiable. One hundred and ninety-three WHO Member States committed to establishing surveillance measures to detect early signs of the emergence of new and resurging illnesses. ","Reflections of the concept of 'One World, One Health' can be seen throughout India's historic socio-cultural fabric. Humankind used to live in harmony as one of the living beings in the ecosystem long before agrarian developments, and one may still see traces of this in our tribal people in India today. 
",
59,PERSPECTIVES,"One planet, one health, one future: The environmental
perspective",Vincenzo Naddeo,"The planet Earth is unique in the known Universe because of its abundance of water, biodiversity, and living species, including humans. Water is essential to all living things; in certain creatures, water accounts for up to 90% of their body weight. ""One Health"" refers to a combined approach to three major areas of knowledge: human health, animal health, and living ecosystems or environmental health.
","It could be a feasible provision in response to global challenges under the collaborative strategy of the One Health concept. Collecting laboratory data, epidemiological data, environmental monitoring data, and shared public evaluation information that emerges during disease outbreaks may assist prevent the generation of large scenarios within the context of the One Health strategy. Comprehensive research on our planet's global health are required. They must address the destiny, incidence, and abundance of both traditional and developing pollutants, as well as integrated strategies/technologies for reducing direct and indirect pressures on humans, animals, and the environment. The ultimate goal of these research must be global health control within the context of sustainable development.",
60,,Promoting the science of One Health,,"The concept of One Health is not new; nevertheless, it has acquired importance in the aftermath of the COVID-19 pandemic, driving national and international organisations to implement One Health policies targeted at minimising disease spillover.
","Addressing One Health research concerns frequently necessitates the use of techniques and approaches from various fields of study. As the scientific field of One Health research matures, it is worth investigating whether more formal frameworks for these investigations could be implemented. For example, are there are specific prerequisites for studies to be designated as One Health research, how may One Health concerns be optimally included into study designs, and how can data from many domains be correctly triangulated to support actions?
",
61,,The One Health path to infectious disease prevention and resilience,Heymann et.al,"The studies and perspectives presented in this special issue of Transactions of the Royal Society of Hygiene and Tropical Medicine transport us to the human-animal interface, where humans are exposed to zoonotic and vector-borne diseases. From mobile pastoralism in the Sahel to small-scale farming in Vietnam to hospital stays in South Korea, a variety of interactions with various ecologies and diseases are reported.
","Recent pandemic threats such as the Ebola and Zika viruses have sparked a global debate about the resilience of health-care systems and their ability to respond and recover when threats arise. The papers to this special issue demonstrate a One Health approach to infectious disease risk assessment and response, emphasising links between human health, animal health, and the environment. This method is critical for infectious disease resilience in general, and for health-care system resilience in particular. In addition to organising systems for rapid diagnosis and response, the One Health perspective encourages us to reconsider prevention. We should, in particular, oppose an economic worldview that is only focused on output or economic expansion at any cost, particularly in fields such as agriculture, where rising zoonotic disease is a concern.",
62,,"The “One Health” approach in the face 
of Covid-19: how radical should it be?",Sironi et.al,"The 2020-2021 coronavirus (Covid-19) pandemic is merely the latest epidemic occurrence that challenges us to reassess and redefine our notion of health. Health should no longer be thought of solely in terms of humans, but as a dimension that unites humans, animals, plants, and the environment (holistic view, One Health). In general, changes in this articulated web of life have a domino effect.
","In this approach, we demonstrate how, by rejecting our anthropocentric view of health, we can better handle the epidemic today and, in the future, treat the entire living system.
We believe that the Prudent approach can be highly beneficial, and we examine the medical and ethical difficulties that it raises. We also explore the Radical viewpoint and the epistemological turn it necessitates in comparison to the Prudent viewpoint.
",
63,,One Health—One Bioflm,Jacques et.al ,"Bioflm/aggregate formation may thus be important for some bacterial species' persistence within their host or environment, whereas it may be more important for other bacterial species' persistence in the environment between infections of different individuals or even between infections of different hosts (humans or animals). This is strikingly similar to the One Health idea, which recognises the interdependence of human, animal, and environmental health. We would want to propose that under this One Health notion, there is also a One Biofilm concept, in which bioflm/aggregate development in humans, animals, and the environment is closely related. Biofilm/aggregates could be the unifying component at the heart of the One Health notion. The One Bioflm concept would support the possibility of bioflm/aggregate development.","Bioflm/aggregate formation may thus be important for some bacterial species' persistence within their host or environment, whereas it may be more important for other bacterial species' persistence in the environment between infections of different individuals or even between infections of different hosts (humans or animals). This is strikingly similar to the One Health idea, which recognises the interdependence of human, animal, and environmental health. We would want to propose that under this One Health notion, there is also a One Biofilm concept, in which bioflm/aggregate development in humans, animals, and the environment is closely related. Biofilm/aggregates could be the unifying component at the heart of the One Health notion. The One Bioflm concept would support the possibility of bioflm/aggregate development.
The One Bioflm notion complicates the One Health concept even further. To address complex problems involving bioflms or bacterial aggregates, a collaborative, multi-stakeholder, multi-sectoral, and transdisciplinary approach is preferred, including the development of new and effective strategies to prevent or control their formation, as well as the persistence and spread of microbial pathogens across environments, animals, and people. The One Bioflm notion is a suggestion, and we would want to ask researchers to expand on it and provide findings to further enhance and refne this novel concept.
",
64,,"Crustaceans, One Health and the changing ocean ",Behringer et.al,"Crustaceans are found in every habitat on Earth, but they have a particularly large impact in the marine environment. They can be small and abundant, such as the ubiquitous marine copepods found throughout the world's oceans, or enormous and highly prized by fisherman, such as spiny lobsters found in tropical and temperate seas worldwide. As a result, crustaceans are not only environmentally significant, but they are also intimately related to human economic and nutritional health. To best successfully manage and protect crab populations in the face of a changing ocean environment, whether harvested or not, a One Health approach that emphasises the interdependence of crustacean, human, and environmental health is required. Here, we provide an outline of the necessity for, benefits of, and problems associated with adopting a One Health approach to crustacean health.","Crustaceans are an essential component of the One Health triad, influencing and being influenced by human and environmental health. It is vital that we close research gaps, such as those concerning the effects of microplastics and other pollutants on crustacean health and how bioaccumulation may affect human health. We must also encourage the implementation of optimal management practises in aquaculture and capture fisheries, as well as better understand the current status and potential for zoonotic infections to originate from crustaceans, as this is a crucial sector for food security and food safety. It is apparent that global change will continue to have an influence on crustaceans, their environment, and the humans that rely on them; thus, we must work in concert, recognising the interdependence of the components in order to ameliorate these changes. 
",
65,,"One Health, “Disease X” & the challenge of “Unknown” Unknowns",Chatterjee et.al ,"The emergence and rapid spread of SARS-CoV-2 highlights the ever-present threat of emerging and re-emerging infectious diseases. The pathogen pyramid concept was used in this analysis to discover the ""unknown unknowns"" linked with the emergence and fast spread of emerging infectious disease pathogens. Given that the evolutionary history of the majority of emerging infectious disease agents can be traced back to an animal source, we believe that the ""One Health"" concept should be integrated into monitoring programmes. The importance of focusing on global and regional mapping operations to uncover novel diseases is emphasised, considering that there are an estimated 1.67 million unknown viruses, of which around 631,000 to 827,000 are capable of infecting humans. The emergence risks due to the ever-expanding interface between human, animals, both domestic and wildlife, and the environment are highlighted, these are largely driven by the need for safe habitation, growing food, developing infrastructure to support the increasing human population and desire for economic growth.","While the immediate focus should be on reducing the COVID-19 threat and minimising costs, both in terms of human lives and economic security, we must also strengthen the defences before the next novel deadly disease arrives. According to Nobel laureate Joshua Lederberg, ""the future of humanity and microbes will likely unfold as episodes of a suspense thriller that could be titled 'Our Wits Versus Their Genes.'""
",
66,,"Brain Health, One Health, and COVID-19",Wiebers et.al,"Brain health is essential to overall wellness. There is no health without brain health. Healthy lifestyle choices, as well as all other preventive measures, medications, and other forms of treatment, are all dependent on behaviour and hence on the brain. All types of brain impairment, including cognitive, psychiatric, psychological, and other neurological impairments, have an impact on the general health of the individual and others around them. There is no way to achieve optimal health unless brain issues are addressed.

","We urge policymakers to carefully consider making One Health the new standard across all sectors, while also developing and implementing equitable economic systems that prioritise human, animal, and environmental health. Failure to heed COVID-19's wake-up call and reconsider our relationship with all life on this planet would not only have a severe influence on brain health, but may also result in the unwitting extinction of all or a significant portion of our species.

",
67,,"One Health aspects & priority roadmap for fungal diseases : A 
mini-review",Banerjee et.al,"Despite causing an estimated two million deaths worldwide each year and the emergence of many troublesome fungal pathogens such as Candida auris, azole resistant Aspergillus fumigatus, terbinafine and azole resistant dermatophytes, and zoonotic sporotrichosis in humans, fungal diseases have not been taken seriously in public health agendas or research priorities. Fungi are also to blame for significant agricultural product and stored crop losses, as well as recent massive and unexpected animal mortality caused by white-nose sickness in bats and Chytridiomycosis in frogs. This review intends to highlight the importance of a collaborative, multi-sectoral, and trans-disciplinary strategy that includes the One Health concept as an essential component of global emerging fungal disease surveillance, prevention, and control.
","Fungal infections are more common than previously thought, due in part to missed diagnoses, in part to new risk factors, and in part to the introduction of new and multidrug resistant organisms. Fungal allergic illness is also rather frequent, as is exposure in water-damaged structures. The last decade saw significant advances in commercialised, easy, and low-cost diagnostic tests that can alter the lives of those affected by chronic illness. The routine use of these diagnostics will reduce needless anti-bacterial therapy and help to manage AMR. Restriction of azole fungicide usage in agriculture could reduce the growth of resistant Aspergillus, which is significant as azole antifungals become more widely used for fungal asthma and prophylaxis. New antifungals with new modes of action are being developed in clinical trials, but their value to human health should be considered before these chemistries are considered for agricultural fungicides.
",
68,,"A One Health approach to overcoming fungal disease and
antifungal resistance",Woods et.al,"The global burden of fungal illness poses a significant hazard to human, animal, and environmental health, affecting both human and cattle populations and posing threats to global food supplies. Antifungal medications treat diseases in humans and animals, whereas fungicides protect crops in agriculture. However, a restricted arsenal of antifungal agents leads to cross-use between agriculture and health, increasing resistance development and significantly decreasing our disease defences. Critically, antifungal resistant isolates identified in the natural environment show resistance to the same types of antifungals used to treat human and animal infections, impeding effective treatment in the clinic. This interconnectedness underscores the need for a One Health approach to battle fungal illnesses and overcome antifungal resistance, ensuring that treatment and prevention are both effective.","Natural antifungal controls, such as microbes with antifungal properties or resource competition among microbes, are examples of One Health strategies. Other examples include the integration of environmental surveillance and tracking of evolution to inform clinical prescriptions and use of antifungals specific to a geographical region, as well as drug synergy and repurposing to improve antifungal efficacy and rapidly advance promising alternative therapies to the clinic. Another significant One Health solution is the goal of reversing antifungal resistance through the identification of important drug targets (e.g., transporters, efflux pumps), stress responses, and virulence factors, which support an anti-virulence approach to limit the selection pressure driving resistance. Finally, developments in genomes, proteomics, and computational platforms lay the groundwork for implementing these One Health solutions to combat fungal illness.",
